{
  "format_version": 2,
  "architecture": "contextual_journey_v1",
  "arrival_model": "nonhomogeneous_poisson",
  "repeat_daily": true,
  "route_time": "planned_departure",
  "weights_file": "weights.json",
  "axes": {
    "period": [
      {
        "start_seconds": 0,
        "end_seconds": 25200
      },
      {
        "start_seconds": 25200,
        "end_seconds": 32400
      },
      {
        "start_seconds": 32400,
        "end_seconds": 57600
      },
      {
        "start_seconds": 57600,
        "end_seconds": 68400
      },
      {
        "start_seconds": 68400,
        "end_seconds": 86400
      }
    ],
    "origin": [
      "south-entry",
      "north-entry",
      "east-entry"
    ],
    "destination": [
      {
        "id": "north",
        "terminal_ids": [
          "north-exit"
        ]
      },
      {
        "id": "south",
        "terminal_ids": [
          "south-exit"
        ]
      },
      {
        "id": "west",
        "terminal_ids": [
          "west-exit"
        ]
      },
      {
        "id": "east",
        "terminal_ids": [
          "east-exit"
        ]
      }
    ],
    "category": [
      "default"
    ],
    "vehicle_type": [
      {
        "id": "car",
        "vehicle_class": "passenger"
      }
    ],
    "movement": [
      {
        "incoming_edge_id": "east_in",
        "outgoing_edge_id": "north_out"
      },
      {
        "incoming_edge_id": "east_in",
        "outgoing_edge_id": "south_out"
      },
      {
        "incoming_edge_id": "east_in",
        "outgoing_edge_id": "west_out"
      },
      {
        "incoming_edge_id": "north_in",
        "outgoing_edge_id": "east_out"
      },
      {
        "incoming_edge_id": "north_in",
        "outgoing_edge_id": "south_out"
      },
      {
        "incoming_edge_id": "north_in",
        "outgoing_edge_id": "west_out"
      },
      {
        "incoming_edge_id": "south_in",
        "outgoing_edge_id": "east_out"
      },
      {
        "incoming_edge_id": "south_in",
        "outgoing_edge_id": "north_out"
      },
      {
        "incoming_edge_id": "south_in",
        "outgoing_edge_id": "west_out"
      },
      {
        "incoming_edge_id": "west_in",
        "outgoing_edge_id": "east_out"
      },
      {
        "incoming_edge_id": "west_in",
        "outgoing_edge_id": "north_out"
      },
      {
        "incoming_edge_id": "west_in",
        "outgoing_edge_id": "south_out"
      }
    ]
  },
  "evidence": [
    {
      "tensor_names": [
        "arrival_rates",
        "journey_logits",
        "movement_logits"
      ],
      "kind": "authored_assumption",
      "note": "All rates, logits, and clock windows are invented for format review. No Podu Ros calibration or training is claimed."
    }
  ]
}
